{
  "numero": "03",
  "nombre": "Código de unidad de medida (UN/ECE Rec 20) — subconjunto usado en abarrotes",
  "listAgencyName": "United Nations Economic Commission for Europe",
  "listID": "UN/ECE rec 20",
  "codigos": [
    { "codigo": "NIU", "descripcion": "Unidad (bienes)" },
    { "codigo": "ZZ", "descripcion": "Unidad (servicios)" },
    { "codigo": "KGM", "descripcion": "Kilogramo" },
    { "codigo": "GRM", "descripcion": "Gramo" },
    { "codigo": "LTR", "descripcion": "Litro" },
    { "codigo": "MLT", "descripcion": "Mililitro" },
    { "codigo": "BX", "descripcion": "Caja" },
    { "codigo": "BG", "descripcion": "Bolsa" },
    { "codigo": "PK", "descripcion": "Paquete" },
    { "codigo": "DZN", "descripcion": "Docena" }
  ]
}
