{
  "numero": "09",
  "nombre": "Códigos de tipo de nota de crédito electrónica",
  "listAgencyName": "PE:SUNAT",
  "listURI": "urn:pe:gob:sunat:cpe:see:gem:catalogos:catalogo09",
  "codigos": [
    { "codigo": "01", "descripcion": "Anulación de la operación" },
    { "codigo": "02", "descripcion": "Anulación por error en el RUC" },
    { "codigo": "03", "descripcion": "Corrección por error en la descripción" },
    { "codigo": "04", "descripcion": "Descuento global" },
    { "codigo": "05", "descripcion": "Descuento por ítem" },
    { "codigo": "06", "descripcion": "Devolución total" },
    { "codigo": "07", "descripcion": "Devolución por ítem" },
    { "codigo": "08", "descripcion": "Bonificación" },
    { "codigo": "09", "descripcion": "Disminución en el valor" },
    { "codigo": "10", "descripcion": "Otros conceptos" },
    { "codigo": "11", "descripcion": "Ajustes de operaciones de exportación" },
    { "codigo": "12", "descripcion": "Ajustes afectos al IVAP" },
    { "codigo": "13", "descripcion": "Ajustes – montos y/o fechas de pago" }
  ]
}
