{
  "numero": "02",
  "nombre": "Código de tipo de moneda (ISO 4217)",
  "listAgencyName": "United Nations Economic Commission for Europe",
  "listID": "ISO 4217 Alpha",
  "codigos": [
    { "codigo": "PEN", "descripcion": "Sol" },
    { "codigo": "USD", "descripcion": "Dólar americano" },
    { "codigo": "EUR", "descripcion": "Euro" }
  ]
}
