{
  "numero": "51",
  "nombre": "Código de tipo de operación (subconjunto)",
  "listAgencyName": "PE:SUNAT",
  "listURI": "urn:pe:gob:sunat:cpe:see:gem:catalogos:catalogo51",
  "codigos": [
    { "codigo": "0101", "descripcion": "Venta interna" },
    { "codigo": "0200", "descripcion": "Exportación de bienes", "fase": 2 },
    { "codigo": "1001", "descripcion": "Operación sujeta a detracción", "fase": 2 }
  ]
}
