{
  "numero": "01",
  "nombre": "Código de tipo de documento",
  "listAgencyName": "PE:SUNAT",
  "listURI": "urn:pe:gob:sunat:cpe:see:gem:catalogos:catalogo01",
  "codigos": [
    { "codigo": "01", "descripcion": "Factura", "prefijoSerie": "F", "ublRoot": "Invoice" },
    { "codigo": "03", "descripcion": "Boleta de venta", "prefijoSerie": "B", "ublRoot": "Invoice" },
    { "codigo": "07", "descripcion": "Nota de crédito", "prefijoSerie": "F|B", "ublRoot": "CreditNote" },
    { "codigo": "08", "descripcion": "Nota de débito", "prefijoSerie": "F|B", "ublRoot": "DebitNote" },
    { "codigo": "09", "descripcion": "Guía de remisión remitente", "prefijoSerie": "T", "ublRoot": "DespatchAdvice", "fase": 2 },
    { "codigo": "20", "descripcion": "Comprobante de retención", "prefijoSerie": "R", "fase": 2 },
    { "codigo": "40", "descripcion": "Comprobante de percepción", "prefijoSerie": "P", "fase": 2 }
  ]
}
