{
  "numero": "05",
  "nombre": "Código de tipos de tributos y otros conceptos",
  "listAgencyName": "PE:SUNAT",
  "schemeURI": "urn:pe:gob:sunat:cpe:see:gem:catalogos:catalogo05",
  "codigos": [
    { "codigo": "1000", "descripcion": "IGV Impuesto General a las Ventas", "nombre": "IGV", "codigoInternacional": "VAT", "categoria": "S" },
    { "codigo": "1016", "descripcion": "Impuesto a la Venta Arroz Pilado", "nombre": "IVAP", "codigoInternacional": "VAT", "categoria": "S" },
    { "codigo": "2000", "descripcion": "ISC Impuesto Selectivo al Consumo", "nombre": "ISC", "codigoInternacional": "EXC", "categoria": "S" },
    { "codigo": "7152", "descripcion": "Impuesto al Consumo de las Bolsas de Plástico", "nombre": "ICBPER", "codigoInternacional": "OTH", "categoria": null },
    { "codigo": "9995", "descripcion": "Exportación", "nombre": "EXP", "codigoInternacional": "FRE", "categoria": "G" },
    { "codigo": "9996", "descripcion": "Gratuito", "nombre": "GRA", "codigoInternacional": "FRE", "categoria": "Z" },
    { "codigo": "9997", "descripcion": "Exonerado", "nombre": "EXO", "codigoInternacional": "VAT", "categoria": "E" },
    { "codigo": "9998", "descripcion": "Inafecto", "nombre": "INA", "codigoInternacional": "FRE", "categoria": "O" },
    { "codigo": "9999", "descripcion": "Otros tributos", "nombre": "OTROS", "codigoInternacional": "OTH", "categoria": "S" }
  ]
}
